{
  "$schema": "../ng-openapi-gen-schema.json",
  "input": "cyclos.json",
  "output": "out/cyclos",
  "includeTags": [
    "Auth",
    "Passwords",
    "Agreements",
    "Users",
    "Phones",
    "Addresses",
    "Contacts",
    "ContactInfos",
    "Transactions",
    "ScheduledPayments",
    "RecurringPayments",
    "PendingPayments",
    "Transfers",
    "Payments",
    "Accounts",
    "Marketplace",
    "UI",
    "Captcha",
    "Files",
    "Images"
  ],
  "enumStyle": "upper",
  "modelPrefix": "Cyclos",
  "modelSuffix": "Model",
  "servicePrefix": "Api",
  "serviceSuffix": "Service"
}
